<?xml version="1.0" encoding="UTF-8"?>
<Schema xmlns="http://www.w3.org/shex/" xmlns:xsi="http://www.w3.org/2001/XMLSchema-instance" exclude-prefixes="xsi shex" xsi:schemaLocation="http://www.w3.org/shex/ ../xsd/ShEx.xsd">
    <shape label="http://a.example/IssueShape">
        <group>
            <tripleConstraint predicate="http://a.example/p1"/>
            <tripleConstraint predicate="http://a.example/p2"/>
            <tripleConstraint predicate="http://a.example/p3"/>
        </group>
            <extra ref="http://a.example/p1"/>
            <extra ref="http://a.example/p2"/>
            <extra ref="http://a.example/p3"/>
        </shape>
    </Schema>