<?xml version="1.0" encoding="UTF-8"?>
<Schema xmlns="http://www.w3.org/shex/" xsi:schemaLocation="http://www.w3.org/shex/ ../xsd/ShEx.xsd" exclude-prefixes="xsi shex" xmlns:xsi="http://www.w3.org/2001/XMLSchema-instance">
    <shape label="http://a.example/IssueShape">
        <group max="3" min="2">
            <tripleConstraint predicate="http://a.example/p1"/>
            <tripleConstraint predicate="http://a.example/p2"/>
            <tripleConstraint predicate="http://a.example/p3"/>
            <annotation iri="http://a.example/annot1">
                <literal>1</literal>
            </annotation>
            <annotation iri="http://a.example/annot2">
                <literal>2</literal>
            </annotation>
            <annotation iri="http://a.example/annot3">
                <literal>3</literal>
            </annotation>
            <actions>
                <action>
                    <codeDecl iri="http://a.example/semAct1"> code1 </codeDecl>
                </action>
                <action>
                    <codeDecl iri="http://a.example/semAct2"> code2 </codeDecl>
                </action>
            </actions>
        </group>
    </shape>
</Schema>