<?xml version="1.0" encoding="UTF-8"?>
<Schema xsi:schemaLocation="http://www.w3.org/shex/ ../xsd/ShEx.xsd" exclude-prefixes="xsi shex" xmlns="http://www.w3.org/shex/" xmlns:xsi="http://www.w3.org/2001/XMLSchema-instance">
    <shape label="http://a.example/S1">
        <tripleConstraint predicate="http://a.example/p1">
            <objectConstraint>
                <valueSet>
                    <iriRange stem="true" base="http://a.example/v">
                        <exclusion base="http://a.example/v1"/>
                        <exclusion base="http://a.example/v2"/>
                        <exclusion base="http://a.example/v3"/>
                    </iriRange>
                </valueSet>
            </objectConstraint>
        </tripleConstraint>
    </shape>
</Schema>