<?xml version="1.0" encoding="UTF-8"?>
<Schema xmlns="http://www.w3.org/shex/" xmlns:xsi="http://www.w3.org/2001/XMLSchema-instance" exclude-prefixes="xsi shex" xsi:schemaLocation="http://www.w3.org/shex/ ../xsd/ShEx.xsd">
    <startActions>
        <action>
            <codeDecl iri="http://a.example/semAct1"> code1 </codeDecl>
        </action>
        <action>
            <codeDecl iri="http://a.example/semAct2"> code2 </codeDecl>
        </action>
        <action>
            <codeDecl iri="http://a.example/semAct3"> code3 </codeDecl>
        </action>
    </startActions>
    <shape label="http://a.example/IssueShape">
        <tripleConstraint predicate="http://a.example/p1"/>
    </shape>
</Schema>