<?xml version="1.0" encoding="UTF-8"?>
<Schema xmlns="http://www.w3.org/shex/" xmlns:xsi="http://www.w3.org/2001/XMLSchema-instance" exclude-prefixes="xsi shex" xsi:schemaLocation="http://www.w3.org/shex/ ../xsd/ShEx.xsd">
    <shape label="http://a.example/IssueShape">
        <tripleConstraint predicate="http://a.example/p1">
            <annotation iri="http://a.example/annot1">
                <literal>1</literal>
            </annotation>
            <annotation iri="http://a.example/annot2">
                <literal>2</literal>
            </annotation>
            <annotation iri="http://a.example/annot3">
                <literal>3</literal>
            </annotation>
        </tripleConstraint>
    </shape>
</Schema>