<?xml version="1.0" encoding="UTF-8"?>
<Schema xsi:schemaLocation="http://www.w3.org/shex/ ../xsd/ShEx.xsd" exclude-prefixes="xsi shex" xmlns="http://www.w3.org/shex/" xmlns:xsi="http://www.w3.org/2001/XMLSchema-instance">
    <shape label="http://a.example/S1">
        <group>
            <tripleConstraint predicate="http://a.example/p1"/>
            <tripleConstraint predicate="http://a.example/p2"/>
            <tripleConstraint predicate="http://a.example/p3"/>
            <actions>
                <action>
                    <codeDecl iri="http://a.example/semAct1"> code1 </codeDecl>
                </action>
            </actions>
        </group>
    </shape>
</Schema>