<?xml version="1.0" encoding="UTF-8"?>
<Schema xmlns="http://www.w3.org/shex/" xsi:schemaLocation="http://www.w3.org/shex/ ../xsd/ShEx.xsd" exclude-prefixes="xsi shex" xmlns:xsi="http://www.w3.org/2001/XMLSchema-instance">
    <shape label="http://a.example/IssueShape">
        <tripleConstraint predicate="http://a.example/p1">
            <objectConstraint>
                <valueSet>
                    <iriRange>
                        <exclusion stem="true" base="http://a.example/v1"/>
                        <exclusion stem="true" base="http://a.example/v2"/>
                        <exclusion stem="true" base="http://a.example/v3"/>
                    </iriRange>
                </valueSet>
            </objectConstraint>
        </tripleConstraint>
    </shape>
</Schema>