<?xml version="1.0" encoding="UTF-8"?>
<Schema xsi:schemaLocation="http://www.w3.org/shex/ ../xsd/ShEx.xsd" exclude-prefixes="xsi shex" xmlns="http://www.w3.org/shex/" xmlns:xsi="http://www.w3.org/2001/XMLSchema-instance">
    <shape label="http://a.example/PersonShape">
        <tripleConstraint predicate="http://a.example/p1"/>
    </shape>
    <shape label="http://a.example/EmployeeShape">
        <tripleConstraint objectType="IRI" objectShape="http://a.example/PersonShape" predicate="http://a.example/p2">
            <objectConstraint>
                <facet>
                    <length>20</length>
                </facet>
            </objectConstraint>
        </tripleConstraint>
    </shape>
</Schema>