<?xml version="1.0" encoding="UTF-8"?>
<Schema xsi:schemaLocation="http://www.w3.org/shex/ ../xsd/ShEx.xsd" exclude-prefixes="xsi shex" xmlns="http://www.w3.org/shex/" xmlns:xsi="http://www.w3.org/2001/XMLSchema-instance">
    <shape label="http://a.example/S1">
        <tripleConstraint predicate="http://a.example/p1" inverse="true">
            <annotation iri="http://a.example/annot1">
                <literal>1</literal>
            </annotation>
            <annotation iri="http://a.example/annot2">
                <literal>2</literal>
            </annotation>
            <annotation iri="http://a.example/annot3">
                <literal>3</literal>
            </annotation>
        </tripleConstraint>
    </shape>
</Schema>